"ID","title","location","lat","long","days","captures","richness","animal.name","scientific.name","year","n_cams","bait","month.of.study","temperature","notes","mean.temp.sampling.period","max.temp.sampling.period","mean.annual.temp","n_sites","sample.design","X22","system","ecosystem","capture_rate","var_caprate","richness_rate","var_richnessrate"
109.1,"Using Camera Traps to Assess Mammal and Bird Assemblages in a Midwestern Forest","Daniel Boone Field Station, Missouri, USA",38.65,90.85,2245,483,16,NA,NA,"2015",42,"no","June-July",NA,NA,24.2,NA,NA,2,"height",NA,"woodland forest","deciduous",0.215144766146993,9.58328579719347e-05,0.00712694877505568,3.17458742764173e-06
110.1,"Conservation implications for jaguars and other neotropical mammals using highway underpasses","Yucatan Peninsula, Mexico",20.75,-87.25,10166,2559,15,NA,NA,"2016-2017",28,"no","July-July",NA,NA,NA,33,30,1,"height",NA,"urban","tropical",0.251721424355695,2.47611080420712e-05,0.0014755065905961,1.45141313259503e-07
112.1,"Gap analysis and implications for seasonal management on a local scale","Yanshan Mountains, China",40.56,117.43,22379,1736,15,NA,NA,"2015",26,"no","September-December",NA,NA,NA,17.6,7.6,1,"distance",NA,"mountain","deciduous",0.0775727244291523,3.46631772774263e-06,0.000670271236427007,2.9950902025426e-08
114.1,"Spatial patterns of medium and large size mammal assemblages in varzea and terra firme forests, Central Amazonia, Brazil","MSDR",-2,-65,2040,1154,20,NA,NA,"2013-2014",51,"no",NA,NA,NA,NA,NA,29.5,1,"grid",NA,"tropical forest","tropical",0.565686274509804,0.000277297193387159,0.00980392156862745,4.80584390618993e-06
114.2,"Spatial patterns of medium and large size mammal assemblages in varzea and terra firme forests, Central Amazonia, Brazil","ASDR",-2.35,-64.266,2070,2289,21,NA,NA,"2013-2014",50,"no",NA,NA,NA,NA,NA,NA,1,"grid",NA,"tropical forest","tropical",1.10579710144928,0.000534201498284674,0.0101449275362319,4.90093117692362e-06
115.1,"Estimating mammalian diversity and relative abundance using camera traps in a tropical deciduous forest of kuldiha Wildlife Sanctuary, eastern India","Kuldiha Wildlife Sanctuary, Eastern India",21.63,86.63,915,912,20,NA,NA,"2013",65,"no","January-August",NA,NA,NA,24,16,1,"grid",NA,"semi-deciduous forest","deciduous",0.99672131147541,0.00108931290871629,0.0218579234972678,2.38884409806205e-05
116.1,"Camera trapping of terrestrial animals in Tanjung Datu National Park, Sarawak, Borneo","Tanjung Datu National Park, Sarawak, Borneo",2.0554,109.642,2490,1189,21,NA,NA,"2013-2015",23,"no","July-October",NA,NA,NA,23,NA,1,"height",NA,"trpical forest","tropical",0.477510040160643,0.000191771100466122,0.00843373493975904,3.38704214448154e-06
117.1,"Mediterranean mesocarnivores in spatially structured managed landscapes: community organisation in time and space","Charneca, Portugal",38.7841,9.147,6496,1645,5,NA,NA,NA,54,"no",NA,NA,NA,NA,NA,NA,1,"distance, haphazard",NA,"deciduous forest","deciduous",0.25323275862069,3.89828754034313e-05,0.000769704433497537,1.18488982989153e-07
119.1,"Habitat preferences of medium/large mammals in human disturbed forests in Central Japan","Akiyama Region, Japan",138.66,36.85,4568.6,724,13,NA,NA,"2008, 2009",30,"no","June-October",NA,NA,NA,NA,10,1,"height",NA,"coniferous forest","coniferous",0.158473055202907,3.46874436814137e-05,0.0028455106597207,6.22840839583396e-07
